1159,Divya Joshi,Android Developer,Engineering,Hyderabad,M.S.,1265230,4,7,3,33,"ElasticSearch, JavaScript, Kubernetes, PyTorch, React",None,1.0,71.551724137931
1160,Simran Patel,QA Engineer,Mobile,Mumbai,B.Tech,1385409,5,7,3,31,"CI/CD, CSS, GraphQL, Jest, Kafka, Microservices, Pandas",AWS Certified,0.92,64.65517241379311
1161,Rohan Kumar,Data Engineer,QA,Delhi,B.Sc,1080504,15,7,1,33,"Java, Kubernetes, Microservices, MongoDB, PyTorch, SQL",AWS Certified,0.83,79.31034482758619
1162,Rohan Reddy,Machine Learning Engineer,Mobile,Gurgaon,B.E.,694564,3,6,5,25,"CSS, Jest, Microservices, MongoDB, NoSQL, Node.js, Spring, TypeScript",None,0.6,21.551724137931032
1163,Rahul Chaudhary,QA Engineer,Mobile,Kolkata,B.Sc,1549330,3,8,3,28,"GraphQL, Java, Jest, NoSQL, Postgres, REST, React",OCI Certified,1.0,68.9655172413793
1164,Ankita Joshi,Product Engineer,Research,Bangalore,B.Sc,1692605,3,8,3,31,"Bootstrap, Docker, GCP, Kubernetes, Node.js, React, Selenium",Kubernetes Cert,0.56,33.62068965517241
1165,Ritika Chopra,Backend Developer,Research,Chennai,B.Tech,1251291,2,8,6,25,"AWS, Angular, Flask, GCP, Java, Kafka, MongoDB, NoSQL",Kubernetes Cert,0.47,13.79310344827584
1166,Karan Bhat,Android Developer,Research,Remote,M.S.,843991,1,9,2,32,"AWS, Bootstrap, Spring, TypeScript",Kubernetes Cert,0.67,45.68965517241378
1167,Divya Bose,Data Engineer,QA,Pune,M.S.,904718,1,7,3,29,"Django, Docker, Flask, GraphQL, Jest, Kubernetes, Redis, Spring",None,1.0,62.931034482758626
1168,Rahul Kaur,DevOps Engineer,Research,Mumbai,MCA,1227430,0,9,3,26,"CI/CD, HTML, REST, Redis, TypeScript",Azure Certified,0.56,27.58620689655173
1169,Krish Chaudhary,Technical Lead,Mobile,Noida,M.S.,1332142,10,9,1,41,"Bootstrap, HTML, JavaScript, Redis, SQL, Selenium",Azure Certified,0.79,81.0344827586207
1170,Isha Kapoor,Product Engineer,Data,Chennai,B.E.,1274249,3,10,3,35,"Bootstrap, CI/CD, ElasticSearch, Flask, Jest, React, Selenium, Spring",GCP Certified,0.76,61.20689655172413
1171,Vivaan Bose,Fullstack Developer,Infrastructure,Chennai,B.Tech,1425413,1,6,3,29,"Django, GraphQL, Pandas, REST",Kubernetes Cert,0.93,53.44827586206897
1172,Rohan Sharma,Android Developer,Platform,Noida,MCA,1126560,0,6,3,31,"Java, MongoDB, NoSQL, REST, SQL, Selenium, TypeScript",Scrum Master,0.81,43.10344827586208
1173,Aditya Chaudhary,Fullstack Developer,Mobile,Bangalore,B.E.,1155899,3,5,4,27,"Docker, ElasticSearch, HTML, JavaScript, Node.js, Postgres, PyTorch",Scrum Master,0.84,42.241379310344826
1174,Rahul Verma,Software Engineer,QA,Remote,B.Sc,1014656,2,9,1,39,"Bootstrap, GraphQL, Microservices, Selenium",OCI Certified,0.89,74.13793103448276
1175,Rohan Bose,Machine Learning Engineer,QA,Chennai,BCA,1688519,1,6,1,32,"GraphQL, Kubernetes, Microservices, NoSQL",Kubernetes Cert,0.69,38.79310344827586
1176,Arjun Sharma,Product Engineer,QA,Mumbai,B.Sc,1348015,0,8,3,35,"CSS, NumPy, Postgres, PyTorch, TypeScript",AWS Certified,0.98,68.10344827586206
1177,Neha Kumar,Backend Developer,Platform,Gurgaon,M.Tech,837108,15,8,2,38,"Docker, Kafka, Kubernetes, Python, TensorFlow",Scrum Master,1.0,100.00000000000001
1178,Shivam Reddy,DevOps Engineer,Mobile,Remote,B.Tech,902792,2,8,1,32,"Docker, ElasticSearch, GCP, GraphQL, HTML, React",Azure Certified,0.45,26.724137931034488
1179,Arjun Chopra,Technical Lead,Mobile,Mumbai,MCA,1050211,0,8,2,34,"ElasticSearch, GCP, Selenium, Spring",OCI Certified,0.91,62.931034482758605
1180,Rohan Das,Product Engineer,Mobile,Delhi,M.S.,1257615,0,7,3,26,"AWS, Docker, GraphQL, Jest, NumPy, PyTorch, REST, TensorFlow",AWS Certified,0.7,32.758620689655174
1181,Pooja Das,Android Developer,Infrastructure,Delhi,B.Tech,847653,1,6,5,25,"Angular, CI/CD, Flask, MongoDB, NoSQL, Node.js, React, Selenium",Scrum Master,0.69,25.86206896551724
1182,Pooja Das,Frontend Developer,Infrastructure,Chennai,MCA,1275392,6,7,2,30,"Angular, GCP, HTML, Java, Kafka, Kubernetes, Node.js, PyTorch",OCI Certified,1.0,74.13793103448276
1183,Isha Chaudhary,Software Engineer,Mobile,Gurgaon,MCA,1525075,2,6,2,31,"ElasticSearch, Java, Kubernetes, Pandas, PyTorch, Python",GCP Certified,0.87,53.44827586206895
1184,Ankita Singh,Software Engineer,Data,Delhi,MCA,1360953,1,6,3,31,"Angular, JavaScript, REST, React",Azure Certified,0.94,56.03448275862068
1185,Sanya Gupta,Backend Developer,Research,Noida,M.Tech,720686,0,7,2,33,"CSS, GraphQL, JavaScript, Kafka, Microservices, NumPy, TensorFlow",None,0.78,47.41379310344829
1186,Rohan Nair,Frontend Developer,Platform,Kolkata,M.S.,1216995,10,8,2,30,"CSS, GCP, GraphQL, HTML, Python, SQL, Spring, TensorFlow",Kubernetes Cert,0.91,76.72413793103446
1187,Simran Bhat,Android Developer,Data,Chennai,B.E.,1062313,0,7,2,30,"CI/CD, Django, ElasticSearch, Kafka, Microservices, Redis, SQL",Scrum Master,0.77,43.9655172413793
1188,Krish Verma,Technical Lead,Data,Remote,BCA,993400,16,7,0,42,"AWS, Angular, Django, Docker",None,0.71,80.17241379310342
1189,Vivaan Das,iOS Developer,Infrastructure,Bangalore,B.E.,677705,1,6,3,30,"AWS, GCP, Kafka, PyTorch",Scrum Master,0.72,36.20689655172414
1190,Vivaan Mehta,Android Developer,QA,Chennai,BCA,739710,3,8,2,32,"Angular, Bootstrap, Docker, GraphQL, Kafka, Kubernetes, SQL, TypeScript",GCP Certified,1.0,74.13793103448276
1191,Sanya Joshi,DevOps Engineer,Engineering,Kolkata,B.Sc,882184,1,5,1,36,"HTML, NumPy, React, Redis, TensorFlow",Scrum Master,1.0,65.51724137931035
1192,Pooja Reddy,Product Engineer,Data,Noida,B.E.,1191033,2,7,0,39,"Flask, HTML, NumPy, Postgres, REST, TensorFlow",Azure Certified,0.72,54.31034482758621
1193,Rohan Das,Software Engineer,Mobile,Noida,M.S.,1317541,2,6,3,35,"Bootstrap, CSS, Django, Flask, NoSQL, Spring, TensorFlow, TypeScript",AWS Certified,0.8,49.13793103448276
1194,Isha Nair,Frontend Developer,Mobile,Chennai,B.Tech,1419704,5,6,4,23,"Angular, Bootstrap, Django, JavaScript, PyTorch, TensorFlow",None,0.87,48.27586206896551
1195,Simran Patel,Machine Learning Engineer,Platform,Delhi,M.Tech,1249996,5,7,4,30,"AWS, Flask, MongoDB, REST",GCP Certified,0.74,46.55172413793103
1196,Ritika Patel,Data Engineer,Platform,Kolkata,M.Tech,1282963,3,8,0,42,"Microservices, Postgres, Redis, SQL, Spring, TensorFlow",None,0.8,68.9655172413793
1197,Divya Das,Frontend Developer,Research,Gurgaon,BCA,1277765,0,8,1,35,"AWS, Bootstrap, ElasticSearch, Java, Selenium, TypeScript",Scrum Master,0.89,63.79310344827587
1198,Siddharth Mehta,Software Engineer,QA,Kolkata,B.Sc,959252,1,9,3,36,"CSS, Django, Flask, MongoDB, NoSQL, Pandas, SQL, Selenium",Scrum Master,0.99,74.99999999999999
1199,Siddharth Malhotra,Android Developer,Infrastructure,Delhi,M.Tech,539052,5,7,1,32,"ElasticSearch, HTML, Microservices, NoSQL, Node.js, Postgres, PyTorch",GCP Certified,0.69,49.13793103448274
1200,Simran Malhotra,Backend Developer,Mobile,Bangalore,B.Sc,1498814,3,6,1,32,"Angular, Pandas, Python, React",GCP Certified,0.67,40.51724137931036
1201,Siddharth Singh,Product Engineer,Platform,Bangalore,B.E.,935861,0,7,2,39,"Docker, ElasticSearch, GraphQL, Jest, Microservices, REST, React, TypeScript",Kubernetes Cert,0.89,62.06896551724138
1202,Divya Sharma,Software Engineer,Mobile,Kolkata,M.S.,1217104,3,7,3,26,"Bootstrap, CI/CD, Java, Selenium",AWS Certified,0.64,32.758620689655174
1203,Pooja Bhat,Backend Developer,Engineering,Hyderabad,B.Sc,610093,2,8,1,34,"Bootstrap, Docker, Kubernetes, MongoDB, Redis",Azure Certified,0.82,60.34482758620689
1204,Neha Singh,QA Engineer,Data,Gurgaon,B.Sc,1292222,1,8,6,24,"GCP, JavaScript, Jest, Node.js, PyTorch",OCI Certified,0.86,44.827586206896534
1205,Neha Iyer,Machine Learning Engineer,Engineering,Bangalore,MCA,1679737,1,7,3,27,"Django, GraphQL, HTML, Node.js, NumPy",None,0.75,39.65517241379311
1206,Vivaan Kaur,Fullstack Developer,Research,Remote,M.S.,1319906,5,6,3,36,"Angular, CI/CD, HTML, JavaScript, Kafka, Selenium",Kubernetes Cert,0.92,65.51724137931036
1207,Vivaan Gupta,QA Engineer,Engineering,Chennai,B.Sc,1455650,3,7,2,38,"Angular, Docker, Jest, NoSQL, PyTorch",None,0.67,47.41379310344829
1208,Neha Iyer,QA Engineer,Data,Pune,BCA,1137293,5,6,3,36,"CSS, Django, React, Redis",OCI Certified,0.65,42.241379310344826
1209,Siddharth Singh,QA Engineer,Mobile,Remote,B.Sc,1646024,2,8,2,37,"CI/CD, Docker, Flask, GCP, Java, PyTorch, TypeScript",Azure Certified,0.81,60.34482758620691
1210,Simran Chopra,Data Engineer,Platform,Remote,MCA,1163716,1,8,1,39,"Docker, JavaScript, Microservices, Node.js, Redis, Selenium, Spring",GCP Certified,0.64,47.41379310344829
1211,Neha Mehta,Product Engineer,Data,Delhi,M.Tech,1201756,1,8,1,37,"Jest, Kafka, Node.js, Python",Azure Certified,0.89,67.24137931034483
1212,Shivam Kumar,Backend Developer,Engineering,Pune,M.S.,1704328,0,6,3,32,"CI/CD, CSS, Django, JavaScript, Pandas, Postgres, Python",AWS Certified,0.8,43.10344827586208
1213,Ritika Shah,QA Engineer,Research,Noida,B.Tech,1522594,4,7,1,39,"CI/CD, ElasticSearch, Kafka, Node.js, Pandas, TensorFlow",GCP Certified,0.75,58.62068965517242
1214,Ankita Bose,Backend Developer,Infrastructure,Noida,B.E.,1507219,1,8,2,34,"Angular, CI/CD, HTML, Jest, SQL",GCP Certified,0.96,68.96551724137929
1215,Sanya Kapoor,Data Engineer,QA,Gurgaon,BCA,1454499,12,8,2,29,"Docker, ElasticSearch, HTML, Kubernetes",None,0.73,63.79310344827586
1216,Ritika Patel,Machine Learning Engineer,Engineering,Pune,M.Tech,947022,1,7,6,27,"GraphQL, Kafka, PyTorch, TensorFlow",Azure Certified,0.93,50.00000000000001
1217,Sanya Shah,Backend Developer,QA,Delhi,B.Sc,1462715,9,7,3,31,"Postgres, PyTorch, REST, Selenium, TypeScript",Kubernetes Cert,0.59,43.10344827586208
1218,Divya Chaudhary,Fullstack Developer,QA,Noida,M.Tech,1242266,1,5,4,27,"CI/CD, ElasticSearch, Flask, GraphQL, MongoDB, Node.js, Selenium",Scrum Master,0.39,0.0
1219,Simran Sharma,Product Engineer,Data,Chennai,M.S.,960151,8,8,0,41,"Angular, Bootstrap, HTML, Pandas, SQL, TypeScript",GCP Certified,1.0,93.96551724137932
1220,Shivam Mehta,Product Engineer,Data,Noida,B.Tech,338615,4,7,2,37,"CI/CD, CSS, Java, Pandas, Postgres, PyTorch, REST",Kubernetes Cert,0.91,68.96551724137929
1221,Simran Shah,Technical Lead,Engineering,Hyderabad,BCA,1568080,9,6,2,34,"GraphQL, JavaScript, NoSQL, PyTorch, Redis",Scrum Master,0.67,50.86206896551724
1222,Sanya Kumar,Software Engineer,Engineering,Mumbai,B.E.,1548067,1,7,2,30,"Bootstrap, CSS, GCP, GraphQL, Kafka, MongoDB, Postgres, TensorFlow",None,0.44,17.241379310344826
1223,Pooja Mehta,QA Engineer,Engineering,Gurgaon,B.Tech,1465214,1,7,2,36,"Angular, Bootstrap, ElasticSearch, Flask, Node.js, Pandas",Azure Certified,0.81,54.31034482758622
1224,Rahul Reddy,Machine Learning Engineer,Research,Chennai,B.Sc,1465382,12,6,2,36,"Bootstrap, CSS, Django, ElasticSearch, GCP, REST, Redis",Azure Certified,0.61,52.586206896551715
1225,Aditya Joshi,Software Engineer,Research,Hyderabad,B.Tech,877960,9,6,4,33,"CI/CD, Django, Docker, Kubernetes, NoSQL, Node.js",GCP Certified,0.78,56.03448275862068
1226,Ananya Iyer,Data Engineer,Data,Chennai,BCA,1252932,2,7,0,40,"Bootstrap, ElasticSearch, Jest, MongoDB, NumPy, Postgres, Python",GCP Certified,0.76,58.62068965517242
1227,Isha Chaudhary,Data Engineer,Data,Bangalore,MCA,1545087,0,6,2,35,"AWS, Angular, CI/CD, Django, Postgres",Azure Certified,0.9,56.03448275862068
1228,Ananya Patel,Machine Learning Engineer,Engineering,Mumbai,MCA,986772,2,7,2,29,"Bootstrap, Jest, MongoDB, React, Selenium, TensorFlow, TypeScript",Azure Certified,0.7,40.51724137931035
1229,Priya Das,iOS Developer,Platform,Mumbai,B.Sc,960242,1,8,4,33,"Bootstrap, Flask, Node.js, REST, React, SQL, Spring, TypeScript",Azure Certified,0.68,40.51724137931035
1230,Rohan Bose,Data Engineer,Data,Remote,B.E.,1225822,4,8,2,31,"CI/CD, Docker, Microservices, NumPy, Postgres, Redis, TensorFlow, TypeScript",GCP Certified,0.81,58.62068965517242
1231,Simran Gupta,Machine Learning Engineer,QA,Pune,B.E.,1464385,2,7,4,32,"Docker, Kafka, Python, REST, React, Redis",GCP Certified,0.69,38.79310344827586
1232,Karan Chopra,Android Developer,Mobile,Gurgaon,M.S.,1122738,4,6,2,36,"HTML, JavaScript, Kafka, Node.js, Pandas, Python, Selenium",Scrum Master,0.39,19.827586206896555
1233,Siddharth Joshi,Software Engineer,QA,Chennai,B.Sc,1519012,2,7,2,34,"CI/CD, HTML, Kubernetes, Microservices, NoSQL, React",None,0.63,38.79310344827586
1234,Krish Kapoor,Android Developer,Research,Delhi,B.Sc,1099567,1,7,3,31,"AWS, Django, Kafka, NumPy",Kubernetes Cert,0.85,51.7241379310345
1235,Siddharth Joshi,Software Engineer,Data,Mumbai,M.Tech,1037260,1,7,2,34,"AWS, Docker, Flask, Kafka",Scrum Master,0.85,56.03448275862068
1236,Ankita Nair,Product Engineer,Mobile,Noida,B.E.,1316966,0,6,0,38,"AWS, CI/CD, CSS, Java, Postgres, PyTorch, Selenium, Spring",Azure Certified,0.68,43.10344827586208
1237,Ritika Iyer,Backend Developer,QA,Mumbai,M.Tech,1378933,6,7,4,27,"AWS, Angular, CI/CD, CSS, Django, Java, PyTorch, TensorFlow",Azure Certified,1.0,68.10344827586205
1238,Rohan Mehta,Fullstack Developer,Platform,Delhi,BCA,1421027,6,6,2,38,"CI/CD, HTML, Pandas, PyTorch, SQL",OCI Certified,0.76,56.89655172413792
1239,Isha Singh,Technical Lead,Research,Hyderabad,M.S.,1089953,0,6,5,30,"CI/CD, Docker, ElasticSearch, Microservices, NoSQL, Python, REST, Selenium",Scrum Master,0.5,12.06896551724138
1240,Aditya Das,Technical Lead,Infrastructure,Delhi,BCA,928889,3,7,2,35,"AWS, HTML, NumPy, PyTorch",Azure Certified,0.87,62.06896551724136
1241,Ananya Joshi,QA Engineer,Mobile,Remote,B.E.,898032,14,8,1,36,"Bootstrap, GraphQL, HTML, Java, Pandas, PyTorch, React, TypeScript",OCI Certified,0.74,75.86206896551724
1242,Aarav Kumar,Backend Developer,Data,Gurgaon,B.Tech,1354172,6,7,5,26,"CSS, Jest, Kafka, MongoDB, Node.js, NumPy, Spring",AWS Certified,0.74,43.103448275862064
1243,Priya Kapoor,Frontend Developer,QA,Pune,B.Tech,858400,1,6,1,42,"GCP, JavaScript, Jest, NumPy, React, Redis, TypeScript",AWS Certified,0.6,39.65517241379311
1244,Karan Malhotra,Frontend Developer,Platform,Remote,B.E.,1039402,4,7,3,28,"AWS, CSS, Kafka, NoSQL, Pandas, Python, React, Redis",Kubernetes Cert,0.88,56.896551724137936
1245,Rohan Malhotra,Frontend Developer,Platform,Noida,B.Tech,1465425,5,7,4,30,"Django, ElasticSearch, Jest, TypeScript",GCP Certified,0.82,53.44827586206895
1246,Neha Mehta,Technical Lead,Infrastructure,Pune,B.Tech,1310186,0,9,1,39,"Django, ElasticSearch, Kafka, Microservices, NoSQL, Postgres, Python, TypeScript",GCP Certified,0.92,73.27586206896554
1247,Sanya Shah,Technical Lead,Data,Chennai,B.Tech,1034149,0,8,1,39,"Flask, Redis, Spring, TensorFlow",OCI Certified,0.67,48.27586206896552
1248,Ananya Mehta,Fullstack Developer,QA,Hyderabad,B.E.,1092869,1,8,4,25,"Django, HTML, Java, Jest, Kubernetes, Microservices, REST, Selenium",Kubernetes Cert,0.93,55.172413793103445
1249,Neha Joshi,Technical Lead,Engineering,Chennai,M.S.,994645,3,6,2,37,"Docker, Flask, HTML, JavaScript, Jest, Kubernetes, TypeScript",AWS Certified,0.92,64.65517241379311
1250,Priya Reddy,Backend Developer,Data,Remote,M.S.,1279547,5,8,4,31,"Angular, JavaScript, Postgres, Python, REST, Selenium",AWS Certified,0.65,43.103448275862064
1251,Shivam Patel,Software Engineer,Engineering,Noida,B.Sc,1059425,1,7,3,29,"CSS, JavaScript, MongoDB, NumPy, Pandas, Redis",Kubernetes Cert,0.9,54.31034482758621
1252,Simran Iyer,iOS Developer,Platform,Mumbai,B.Tech,1123024,3,4,5,28,"AWS, Angular, CI/CD, CSS, Node.js, PyTorch",Azure Certified,0.92,44.827586206896555
1253,Neha Chaudhary,Technical Lead,Research,Hyderabad,M.Tech,1261815,1,4,3,29,"AWS, Bootstrap, CSS, Docker, JavaScript, Microservices, React",OCI Certified,0.57,15.517241379310333
1254,Ritika Shah,Software Engineer,QA,Pune,B.Tech,1224732,0,5,0,42,"HTML, NoSQL, Python, Spring",Azure Certified,0.96,67.24137931034483
1255,Pooja Bose,Product Engineer,QA,Pune,M.Tech,1026741,3,5,2,37,"CI/CD, Flask, GraphQL, Java, NumPy",Azure Certified,0.82,52.586206896551715
1256,Pooja Singh,DevOps Engineer,Infrastructure,Remote,MCA,1239641,6,9,1,42,"CSS, ElasticSearch, HTML, Microservices",AWS Certified,0.79,74.99999999999999
1257,Divya Chaudhary,Backend Developer,QA,Pune,M.Tech,1022917,8,7,4,23,"CSS, Flask, GCP, Python",AWS Certified,0.63,36.20689655172413
1258,Aarav Kaur,Software Engineer,Data,Delhi,M.S.,1055082,1,7,0,38,"GCP, JavaScript, Pandas, Postgres, TypeScript",GCP Certified,0.69,49.13793103448274
1259,Sanya Reddy,DevOps Engineer,Research,Hyderabad,B.Sc,1302845,1,4,1,35,"Bootstrap, CSS, Flask, Node.js, PyTorch, React",None,0.69,34.48275862068965
1260,Vivaan Chopra,Frontend Developer,Data,Mumbai,BCA,1138436,1,8,5,21,"Django, Microservices, Node.js, Postgres, Python, TypeScript",Azure Certified,0.75,34.48275862068965
1261,Ankita Joshi,Product Engineer,Mobile,Chennai,M.S.,1104796,3,7,6,26,"AWS, Angular, Docker, HTML, MongoDB, Python",AWS Certified,1.0,58.62068965517242
1262,Siddharth Iyer,QA Engineer,Infrastructure,Bangalore,M.Tech,1147609,5,5,0,39,"AWS, Django, Jest, TensorFlow",None,0.7,50.86206896551724
1263,Siddharth Bhat,Machine Learning Engineer,Engineering,Pune,MCA,1732593,3,6,6,24,"GCP, JavaScript, Kafka, Kubernetes, Node.js, NumPy",OCI Certified,0.64,22.413793103448285
1264,Priya Das,Product Engineer,Engineering,Remote,B.Tech,1118272,1,7,2,35,"AWS, Angular, GraphQL, Java, PyTorch, REST, Selenium, Spring",GCP Certified,0.66,40.51724137931035
1265,Siddharth Joshi,DevOps Engineer,Research,Delhi,BCA,1070953,0,9,1,42,"Bootstrap, Django, Flask, JavaScript, Kafka, Spring, TypeScript",GCP Certified,1.0,82.75862068965517
1266,Ankita Kumar,Backend Developer,Engineering,Pune,M.S.,1533091,3,6,1,37,"CI/CD, Django, Flask, Pandas, Postgres, TensorFlow, TypeScript",OCI Certified,1.0,73.27586206896554
1267,Rahul Das,DevOps Engineer,Research,Hyderabad,B.Tech,1061371,0,6,3,31,"AWS, JavaScript, Jest, SQL, TypeScript",AWS Certified,0.8,42.241379310344826
1268,Siddharth Nair,Data Engineer,Mobile,Bangalore,MCA,1155442,2,8,1,36,"Java, Kubernetes, MongoDB, NumPy, Postgres, REST",OCI Certified,0.88,67.24137931034483
1269,Simran Iyer,Fullstack Developer,Engineering,Gurgaon,B.Tech,1111356,0,7,6,22,"Flask, GCP, Python, React, Spring",GCP Certified,0.83,35.344827586206875
1270,Neha Nair,Technical Lead,Infrastructure,Hyderabad,B.Sc,841822,2,7,4,25,"Angular, Django, GCP, Java, JavaScript, Kafka, Kubernetes, TypeScript",Scrum Master,0.8,42.24137931034481
1271,Rohan Singh,QA Engineer,Engineering,Bangalore,M.S.,803370,3,8,2,31,"HTML, NoSQL, NumPy, PyTorch",AWS Certified,0.72,49.13793103448274
1272,Neha Bhat,Backend Developer,QA,Chennai,B.E.,1297320,1,7,3,33,"CI/CD, Java, Jest, Kafka, Microservices, SQL",None,0.62,33.62068965517241
1273,Siddharth Joshi,Machine Learning Engineer,Data,Kolkata,M.S.,1349010,2,7,4,28,"CI/CD, Node.js, Spring, TensorFlow",OCI Certified,0.71,37.06896551724137
1274,Karan Bose,Fullstack Developer,Infrastructure,Kolkata,BCA,1292415,0,7,4,25,"HTML, REST, Redis, TensorFlow",Azure Certified,0.66,26.724137931034488
1275,Ankita Bose,QA Engineer,Data,Mumbai,B.E.,1208663,4,5,3,36,"CI/CD, GCP, Java, TypeScript",AWS Certified,0.79,49.13793103448276
1276,Divya Bose,QA Engineer,Research,Remote,B.E.,559298,3,10,7,22,"CI/CD, Django, Docker, GCP, React",None,0.59,28.448275862068954
1277,Neha Nair,Backend Developer,Platform,Chennai,B.Sc,1488927,1,6,0,41,"Bootstrap, Java, Microservices, REST, Redis, Selenium",GCP Certified,0.67,46.551724137931046
1278,Ankita Patel,Machine Learning Engineer,Mobile,Mumbai,B.E.,1194387,3,7,2,33,"Flask, JavaScript, Jest, Node.js, Python, REST, React",None,0.97,68.96551724137929
1279,Divya Sharma,QA Engineer,Mobile,Chennai,BCA,1040533,1,8,1,32,"GraphQL, Java, Postgres, React, TypeScript",GCP Certified,0.88,62.06896551724139
1280,Ankita Mehta,Frontend Developer,Research,Kolkata,BCA,1562780,0,5,0,42,"Angular, ElasticSearch, NoSQL, PyTorch, React, Selenium",Azure Certified,0.9,62.06896551724136
1281,Ananya Mehta,Backend Developer,Infrastructure,Noida,BCA,1554736,4,7,1,35,"Flask, GraphQL, Pandas, Postgres, Redis, Selenium, TypeScript",GCP Certified,0.96,73.27586206896551
1282,Neha Joshi,Product Engineer,Infrastructure,Mumbai,B.E.,997447,1,7,3,28,"JavaScript, Postgres, PyTorch, Python, TypeScript",Scrum Master,0.52,20.689655172413794
1283,Ritika Kaur,Technical Lead,Mobile,Hyderabad,M.S.,1263988,0,9,1,33,"Angular, Docker, GraphQL, Redis, TypeScript",GCP Certified,0.8,57.758620689655174
1284,Aditya Reddy,Machine Learning Engineer,Engineering,Mumbai,B.E.,1494394,1,8,3,32,"Angular, Django, Kubernetes, Python, Redis",AWS Certified,0.76,48.27586206896551
1285,Neha Das,Product Engineer,Data,Pune,M.S.,1390008,2,8,4,23,"Bootstrap, Docker, Pandas, PyTorch, React, Redis, TensorFlow",Scrum Master,0.61,27.586206896551715
1286,Ankita Kaur,Backend Developer,Data,Hyderabad,BCA,1403383,2,7,4,26,"Java, Kubernetes, Selenium, TypeScript",AWS Certified,0.64,29.31034482758621
1287,Aditya Reddy,Backend Developer,Data,Pune,MCA,895125,2,6,4,23,"GraphQL, Java, Node.js, REST",OCI Certified,1.0,54.31034482758621
1288,Arjun Shah,Data Engineer,Platform,Bangalore,B.Tech,1012143,1,7,1,33,"AWS, CI/CD, ElasticSearch, MongoDB, Pandas, Redis",Kubernetes Cert,0.49,25.862068965517253
1289,Simran Kapoor,Technical Lead,QA,Mumbai,B.E.,1071284,8,7,6,24,"HTML, PyTorch, React, SQL",AWS Certified,0.82,50.00000000000001
1290,Priya Sharma,Data Engineer,Engineering,Mumbai,BCA,1180336,1,9,2,35,"Django, HTML, MongoDB, Node.js, Python, REST, SQL, TypeScript",AWS Certified,0.88,66.37931034482759
1291,Divya Kumar,DevOps Engineer,Research,Noida,M.S.,1091990,1,6,3,28,"CSS, Kafka, Kubernetes, MongoDB, Node.js, Postgres, TensorFlow",Azure Certified,0.74,36.20689655172414
1292,Arjun Das,Software Engineer,QA,Gurgaon,M.S.,1068567,1,7,4,25,"Angular, CI/CD, GCP, React, Redis, TensorFlow",Kubernetes Cert,0.72,33.6206896551724
1293,Krish Singh,Technical Lead,QA,Kolkata,M.S.,1155666,4,8,3,33,"AWS, CI/CD, GCP, GraphQL, Kubernetes, Pandas, React, TensorFlow",Scrum Master,0.75,53.44827586206897
1294,Divya Chaudhary,Fullstack Developer,Data,Mumbai,B.Tech,1544827,4,8,0,43,"CSS, GCP, JavaScript, Node.js, React, SQL, TensorFlow",GCP Certified,0.86,76.72413793103446
1295,Karan Patel,Backend Developer,Engineering,Noida,B.Tech,929385,4,8,2,32,"ElasticSearch, Kubernetes, Microservices, MongoDB, NoSQL, PyTorch, SQL",AWS Certified,0.59,40.517241379310335
1296,Aditya Chopra,Android Developer,Data,Kolkata,M.Tech,1500626,5,8,1,41,"Bootstrap, Jest, Microservices, PyTorch, Python, Redis",None,0.77,67.24137931034483
1297,Pooja Bhat,Frontend Developer,Data,Pune,B.E.,901695,2,8,1,42,"Bootstrap, CI/CD, CSS, Django, NumPy, Postgres, PyTorch, SQL",OCI Certified,0.44,34.482758620689665
1298,Shivam Chopra,Technical Lead,Data,Remote,B.Sc,1623563,2,6,1,41,"Angular, CI/CD, JavaScript, Jest, Kafka, MongoDB, Postgres",Kubernetes Cert,0.83,60.34482758620689
1299,Neha Verma,Data Engineer,QA,Chennai,B.Tech,1529353,0,5,1,36,"CI/CD, ElasticSearch, Java, NoSQL, Pandas, PyTorch, SQL",Azure Certified,0.6,29.31034482758621
1300,Shivam Malhotra,Product Engineer,Infrastructure,Hyderabad,BCA,1573216,1,6,4,26,"CI/CD, Jest, Kafka, Spring, TypeScript",Kubernetes Cert,0.83,40.517241379310335
1301,Sanya Shah,Technical Lead,Engineering,Chennai,M.S.,1273186,5,4,1,40,"Bootstrap, ElasticSearch, HTML, Pandas, React",None,0.66,43.103448275862064
1302,Arjun Singh,DevOps Engineer,Infrastructure,Kolkata,M.S.,1245040,2,8,0,44,"Bootstrap, Java, MongoDB, Postgres, React",GCP Certified,0.82,70.68965517241378
1303,Vivaan Das,Software Engineer,QA,Chennai,M.Tech,1207628,1,10,3,35,"Bootstrap, CSS, Microservices, PyTorch, React, TypeScript",Kubernetes Cert,0.86,66.37931034482759
1304,Aarav Kaur,QA Engineer,Data,Remote,M.S.,1087441,3,7,2,33,"Kubernetes, NoSQL, Node.js, REST, Redis",Azure Certified,0.94,66.37931034482759
1305,Aarav Chopra,Software Engineer,Platform,Remote,BCA,1218183,1,8,4,24,"AWS, CI/CD, CSS, GCP, Pandas",AWS Certified,0.88,50.00000000000001
1306,Aarav Malhotra,Backend Developer,Infrastructure,Pune,B.Sc,1334883,2,7,1,32,"CI/CD, GCP, Jest, Kubernetes",OCI Certified,0.81,54.31034482758622
1307,Neha Nair,Machine Learning Engineer,QA,Chennai,M.S.,1375372,1,9,0,40,"Bootstrap, Django, GraphQL, Kubernetes, PyTorch, Python",Scrum Master,0.8,67.24137931034483
1308,Priya Iyer,Technical Lead,Mobile,Remote,M.Tech,807728,2,7,5,30,"Angular, Django, NoSQL, REST, Spring, TypeScript",Azure Certified,0.87,50.862068965517224
1309,Shivam Kapoor,Technical Lead,Infrastructure,Mumbai,B.E.,1311328,1,5,2,34,"Bootstrap, Docker, PyTorch, React, TypeScript",Kubernetes Cert,0.87,50.86206896551724
1310,Rohan Sharma,Technical Lead,Data,Mumbai,M.Tech,1360542,1,8,6,20,"JavaScript, Pandas, PyTorch, REST, Redis, Selenium, TensorFlow",GCP Certified,0.91,45.6896551724138
1311,Ananya Kaur,Technical Lead,Mobile,Gurgaon,MCA,812018,3,7,2,38,"CSS, GraphQL, Jest, Kafka, NoSQL, Pandas",None,0.62,43.10344827586208
1312,Arjun Joshi,Frontend Developer,Data,Pune,MCA,1035256,2,9,1,41,"Bootstrap, Flask, GraphQL, Node.js, Postgres, REST",Kubernetes Cert,0.93,79.31034482758622
1313,Rahul Bhat,QA Engineer,QA,Mumbai,B.Sc,1064373,4,7,0,37,"Flask, Java, Microservices, NumPy, REST, TypeScript",None,0.67,51.72413793103448
1314,Ankita Shah,Frontend Developer,Data,Chennai,B.Sc,2248763,2,5,1,34,"Bootstrap, Jest, Pandas, TensorFlow",AWS Certified,0.79,47.41379310344829
1315,Rohan Mehta,Fullstack Developer,QA,Noida,B.Sc,998317,1,8,5,30,"Docker, JavaScript, NoSQL, Postgres, SQL, TensorFlow, TypeScript",Kubernetes Cert,0.51,21.551724137931032
1316,Arjun Reddy,Technical Lead,Engineering,Bangalore,M.S.,1077889,9,8,3,35,"AWS, CSS, Docker, NoSQL, PyTorch, TensorFlow",Scrum Master,0.77,65.51724137931033
1317,Aditya Mehta,iOS Developer,Data,Noida,M.S.,1252002,2,9,3,33,"CI/CD, Django, ElasticSearch, Java, Python, REST, TensorFlow",Azure Certified,0.72,50.86206896551724
1318,Aarav Reddy,Android Developer,Platform,Bangalore,MCA,1034784,6,6,1,35,"Docker, GCP, Jest, Redis",GCP Certified,0.9,68.10344827586208
1319,Krish Chopra,Android Developer,Mobile,Mumbai,B.E.,1090391,2,6,3,29,"JavaScript, Jest, Microservices, Selenium",Kubernetes Cert,0.98,59.482758620689665
1320,Pooja Shah,Android Developer,QA,Noida,MCA,1048746,0,7,1,40,"GraphQL, HTML, MongoDB, NoSQL, Redis",Scrum Master,0.77,54.31034482758621
