1483,Rohan Kapoor,Software Engineer,QA,Noida,MCA,1239306,0,8,0,43,"CSS, Jest, NoSQL, NumPy, Postgres, PyTorch, React, TensorFlow",Azure Certified,0.48,37.06896551724138
1484,Ananya Verma,DevOps Engineer,Data,Hyderabad,M.S.,1152319,4,6,3,34,"AWS, Bootstrap, ElasticSearch, Jest, Kafka",Azure Certified,1.0,68.9655172413793
1485,Arjun Kumar,QA Engineer,Research,Bangalore,BCA,1399478,1,5,1,33,"CSS, Java, Kafka, Node.js, REST",None,0.72,38.79310344827586
1486,Rohan Patel,QA Engineer,Data,Kolkata,M.Tech,1353450,2,9,1,33,"CSS, Django, ElasticSearch, Java, SQL, Spring",OCI Certified,1.0,78.44827586206897
1487,Neha Bose,Frontend Developer,Engineering,Mumbai,B.Tech,1581125,6,8,6,19,"GraphQL, Java, Kafka, Kubernetes, Microservices, Node.js, React, TensorFlow",Kubernetes Cert,0.63,29.310344827586224
1488,Rahul Sharma,iOS Developer,Research,Mumbai,MCA,1566246,2,6,4,32,"CI/CD, Kafka, MongoDB, Selenium, TypeScript",Kubernetes Cert,0.85,49.13793103448274
1489,Krish Kapoor,Backend Developer,Platform,Mumbai,B.Tech,1435290,2,8,1,34,"AWS, CSS, Django, Redis",None,1.0,75.86206896551724
1490,Ananya Kapoor,Backend Developer,Infrastructure,Mumbai,B.Sc,899681,1,7,5,26,"Angular, GraphQL, Jest, Kafka, NoSQL",AWS Certified,0.41,6.034482758620682
1491,Rohan Sharma,Machine Learning Engineer,Infrastructure,Bangalore,B.Tech,1043580,1,9,1,38,"CSS, Jest, MongoDB, Node.js, NumPy, React, Redis",None,1.0,81.0344827586207
1492,Isha Shah,QA Engineer,QA,Delhi,BCA,881006,0,6,3,36,"Django, Jest, Microservices, Node.js, Spring",Kubernetes Cert,0.93,57.758620689655174
1493,Isha Malhotra,Fullstack Developer,Platform,Pune,BCA,876787,3,8,2,33,"ElasticSearch, GraphQL, HTML, Kubernetes, NoSQL, Node.js, PyTorch, Redis",Scrum Master,0.92,68.10344827586206
1494,Ananya Das,Machine Learning Engineer,Engineering,Hyderabad,M.S.,921488,1,8,3,36,"Microservices, NoSQL, REST, Redis",Azure Certified,0.9,63.79310344827586
1495,Priya Shah,iOS Developer,Platform,Kolkata,B.Tech,1236923,1,6,3,26,"Angular, CI/CD, Django, GCP, PyTorch, SQL, TypeScript",OCI Certified,0.79,38.79310344827587
1496,Ankita Bhat,Fullstack Developer,Mobile,Chennai,B.Sc,1268722,7,8,5,22,"AWS, Angular, GraphQL, REST, TensorFlow",Scrum Master,0.74,44.827586206896555
1497,Ankita Bhat,Data Engineer,Mobile,Delhi,B.Sc,1078990,5,6,2,37,"Angular, Flask, HTML, Microservices, Postgres",Azure Certified,0.5,31.896551724137936
1498,Simran Kumar,Machine Learning Engineer,Platform,Mumbai,M.S.,1221376,1,5,3,33,"Django, HTML, TensorFlow, TypeScript",Kubernetes Cert,0.96,56.03448275862068
1499,Vivaan Singh,Fullstack Developer,Research,Pune,B.Sc,1381236,8,7,6,24,"Kafka, SQL, Selenium, TensorFlow",None,0.95,61.20689655172414
1500,Ankita Das,Fullstack Developer,Platform,Delhi,M.Tech,777569,0,8,1,36,"Bootstrap, JavaScript, Jest, Kubernetes, NumPy, Python, Redis, Selenium",OCI Certified,1.0,74.13793103448276
1501,Rohan Joshi,Software Engineer,QA,Kolkata,B.Tech,1200205,1,8,2,36,"Flask, Java, Redis, Selenium",GCP Certified,0.92,67.24137931034484
1502,Sanya Chaudhary,Data Engineer,Infrastructure,Delhi,MCA,737899,7,5,1,35,"CI/CD, Django, GraphQL, Node.js, NumPy, PyTorch, TensorFlow",OCI Certified,0.65,44.827586206896555
1503,Rohan Patel,Android Developer,Data,Delhi,BCA,1114753,3,8,2,30,"Angular, JavaScript, Python, SQL, Selenium, Spring, TypeScript",AWS Certified,1.0,72.41379310344828
1504,Rohan Malhotra,Technical Lead,Data,Pune,B.Tech,1005916,3,6,1,39,"CSS, Microservices, NumPy, Pandas, Postgres",OCI Certified,0.87,63.79310344827586
1505,Simran Das,Data Engineer,QA,Chennai,B.E.,1360124,1,6,2,29,"AWS, Docker, HTML, Kubernetes, Python, Redis, Spring",None,0.86,49.13793103448276
1506,Ankita Nair,Software Engineer,Engineering,Remote,M.S.,1193093,0,6,1,35,"Angular, ElasticSearch, Flask, Microservices, Node.js, REST",None,1.0,66.37931034482759
1507,Shivam Das,Android Developer,Engineering,Kolkata,B.Sc,926141,8,7,2,34,"Angular, Docker, Jest, REST",None,0.86,68.96551724137929
1508,Vivaan Reddy,Android Developer,Research,Bangalore,M.S.,859681,2,8,2,30,"AWS, CSS, GraphQL, Postgres, PyTorch, REST, SQL",Azure Certified,0.8,53.44827586206895
1509,Arjun Verma,Product Engineer,Mobile,Mumbai,MCA,1160963,0,6,7,19,"GraphQL, HTML, Java, Kubernetes, Node.js, REST, React, Selenium",Azure Certified,0.91,34.48275862068965
1510,Ritika Sharma,DevOps Engineer,Data,Hyderabad,B.E.,1366009,1,7,0,45,"Angular, Bootstrap, CI/CD, Jest, Kafka, Kubernetes, NumPy, Spring",AWS Certified,0.88,71.55172413793103
1511,Krish Shah,Backend Developer,Mobile,Pune,MCA,1493511,3,9,6,17,"Docker, ElasticSearch, Flask, Kubernetes, Postgres, PyTorch, Redis",GCP Certified,0.52,16.379310344827605
1512,Pooja Verma,QA Engineer,Engineering,Pune,B.Sc,965713,3,6,2,39,"Docker, HTML, Kafka, Pandas, TensorFlow",Kubernetes Cert,0.96,69.82758620689656
1513,Arjun Patel,iOS Developer,Infrastructure,Delhi,B.Tech,1635785,1,8,1,35,"Docker, Flask, GCP, MongoDB, NoSQL, React",Azure Certified,0.69,48.27586206896552
1514,Divya Iyer,Fullstack Developer,Data,Noida,M.S.,1327220,1,7,2,34,"Bootstrap, Microservices, NumPy, PyTorch, Python, SQL",OCI Certified,0.72,44.827586206896534
1515,Neha Reddy,Android Developer,Infrastructure,Bangalore,B.Tech,1187718,0,6,3,29,"CI/CD, Microservices, NoSQL, NumPy, PyTorch, React, Redis, Spring",Azure Certified,0.78,38.79310344827587
1516,Ankita Chopra,Machine Learning Engineer,Research,Chennai,MCA,1619785,1,7,4,24,"CI/CD, CSS, GraphQL, Kafka, MongoDB, NoSQL, Postgres, Python",Scrum Master,0.83,42.24137931034481
1517,Aditya Sharma,Data Engineer,Engineering,Kolkata,B.Tech,1362627,4,8,1,34,"Django, GCP, Java, Python, Redis, Selenium, Spring",None,0.73,56.03448275862068
1518,Aditya Verma,iOS Developer,Infrastructure,Chennai,B.Sc,777268,0,7,4,23,"Flask, Node.js, Spring, TensorFlow",Kubernetes Cert,0.85,41.37931034482759
1519,Ankita Gupta,Frontend Developer,Infrastructure,Pune,M.Tech,1250418,2,7,2,38,"Angular, Bootstrap, HTML, Microservices, Spring, TensorFlow",OCI Certified,0.64,43.103448275862064
1520,Ananya Kapoor,Backend Developer,Research,Hyderabad,M.Tech,1168054,5,6,3,27,"GraphQL, Kubernetes, React, TensorFlow",Scrum Master,0.77,44.827586206896555
1521,Shivam Gupta,Machine Learning Engineer,Engineering,Gurgaon,B.E.,1651264,13,7,5,24,"AWS, Angular, CI/CD, HTML, Postgres, PyTorch, React, TensorFlow",GCP Certified,0.8,58.62068965517242
1522,Ritika Kumar,Machine Learning Engineer,Infrastructure,Mumbai,B.Tech,1541673,1,7,2,32,"Angular, Java, Kafka, Kubernetes",OCI Certified,0.64,36.20689655172414
1523,Rohan Sharma,Software Engineer,Infrastructure,Noida,M.Tech,963046,1,5,4,31,"CSS, GraphQL, HTML, PyTorch, Python",OCI Certified,0.87,44.827586206896534
1524,Sanya Chopra,Product Engineer,Research,Hyderabad,B.Sc,1567578,1,7,7,22,"Flask, Python, REST, Redis, TensorFlow",Azure Certified,0.87,38.79310344827586
1525,Rahul Chopra,Software Engineer,Infrastructure,Hyderabad,M.Tech,1059653,2,8,2,29,"Django, GraphQL, Microservices, Node.js, REST, SQL, TensorFlow, TypeScript",GCP Certified,0.74,47.41379310344827
1526,Simran Verma,Data Engineer,Infrastructure,Chennai,M.Tech,1202768,0,9,7,16,"Django, GCP, HTML, JavaScript, Kafka, Redis, TypeScript",Kubernetes Cert,0.66,20.689655172413794
1527,Karan Mehta,Software Engineer,Platform,Bangalore,MCA,1384188,2,8,2,38,"CI/CD, Docker, HTML, JavaScript, PyTorch, SQL, TensorFlow, TypeScript",OCI Certified,0.95,73.27586206896551
1528,Simran Das,Software Engineer,Engineering,Delhi,B.Tech,1133807,2,6,0,44,"CSS, Django, Flask, JavaScript, PyTorch, TypeScript",Kubernetes Cert,0.7,53.44827586206897
1529,Pooja Das,Technical Lead,Research,Kolkata,B.E.,952719,10,8,2,30,"Angular, CSS, Docker, ElasticSearch, GCP, JavaScript, Python, TypeScript",OCI Certified,0.96,81.03448275862067
1530,Ritika Verma,Fullstack Developer,Infrastructure,Pune,B.Tech,1080030,12,7,3,32,"Django, Jest, Microservices, NoSQL, React",Scrum Master,0.68,56.89655172413795
1531,Ankita Singh,Frontend Developer,Engineering,Gurgaon,B.Sc,1830294,2,8,8,15,"AWS, Angular, ElasticSearch, GCP, MongoDB, NoSQL, Pandas, PyTorch",Kubernetes Cert,0.88,37.06896551724138
